{
  "$schema": "../schemas/components.schema.json",
  "meta": {
    "name": "QenTerra Component Tokens",
    "version": "1.1.1",
    "type": "components",
    "description": "Shared component metrics and mandatory state contracts."
  },
  "button": {
    "heights": {
      "compact": "{size.controlCompact}",
      "standard": "{size.controlStandard}",
      "prominent": "{size.controlProminent}"
    },
    "paddingX": {
      "compact": 10,
      "standard": 12,
      "prominent": 16
    },
    "radius": "{radius.control}",
    "iconGap": "{space.2}",
    "roles": [
      "primary",
      "secondary",
      "quiet",
      "destructive",
      "icon",
      "menuRow",
      "link"
    ],
    "states": [
      "default",
      "hover",
      "pressed",
      "focused",
      "selected",
      "disabled",
      "loading"
    ]
  },
  "interactiveRow": {
    "heights": {
      "compact": "{size.rowCompact}",
      "standard": "{size.rowStandard}",
      "comfortable": "{size.rowComfortable}"
    },
    "radius": "{radius.control}",
    "paddingX": "{space.3}",
    "gap": "{space.3}",
    "states": [
      "default",
      "hover",
      "pressed",
      "focused",
      "selected",
      "disabled",
      "unavailable"
    ]
  },
  "group": {
    "radius": "{radius.group}",
    "padding": "{space.4}",
    "gap": "{space.3}",
    "border": "border.default",
    "surface": "surface.secondary"
  },
  "panel": {
    "radius": "{radius.panel}",
    "padding": "{space.5}",
    "gap": "{space.4}",
    "surface": "surface.overlay",
    "artwork": {
      "minimumSide": 64,
      "heroSide": 320,
      "cornerRadius": "{radius.hero}",
      "surfaceCornerRadius": 8,
      "highlightOpacity": 0.52,
      "highlightSizeRatio": 0.72,
      "highlightBlurRatio": 0.12,
      "highlightOffsetXRatio": 0.2,
      "highlightOffsetYRatio": -0.18,
      "scrimOpacity": 0.42,
      "symbolOpacity": 0.62,
      "symbolSizeRatio": 0.18,
      "symbolMinimumSize": 10,
      "symbolMaximumSize": 34,
      "artistPaddingRatio": 0.2,
      "collectionPaddingRatio": 0.26,
      "trackPaddingRatio": 0.3,
      "artistOffsetRatio": 0.013,
      "cropPreviewSide": 340,
      "cropMinimumScale": 1,
      "cropMaximumScale": 4,
      "cropBorderOpacity": 0.32,
      "mosaicGap": 1,
      "mosaicBorderOpacity": 0.14,
      "mosaicEmptySymbolSize": 42,
      "hazeLeadingStartRadius": 18,
      "hazeLeadingEndRadius": 330,
      "hazeTrailingStartRadius": 12,
      "hazeTrailingEndRadius": 310,
      "hazeFalloffRatio": 0.42,
      "hazeBackgroundFalloffRatio": 0.84,
      "hazeBlurRadius": 44,
      "hazeDarkSaturation": 1.12,
      "hazeLightSaturation": 1.28,
      "hazeDarkLeadingOpacity": 0.48,
      "hazeLightLeadingOpacity": 0.62,
      "hazeDarkTrailingOpacity": 0.4,
      "hazeLightTrailingOpacity": 0.54,
      "hazeDarkBackgroundOpacity": 0.12,
      "hazeLightBackgroundOpacity": 0.22
    },
    "mediaCollection": {
      "gridMinimumWidth": 164,
      "gridMaximumWidth": 196,
      "tilePadding": 8,
      "tileTextGap": 4,
      "rowHeight": 48,
      "rowArtworkSide": 40,
      "rowGap": 8,
      "favoriteControlSize": 30,
      "favoriteCompactControlSize": 22,
      "pressedOpacity": 0.72,
      "playbackIndicatorBarWidth": 3,
      "playbackIndicatorGap": 2.5,
      "playbackIndicatorMaximumHeight": 17,
      "playbackIndicatorVerticalInset": 14,
      "playbackIndicatorCornerRadius": 1.5,
      "playbackIndicatorStaticFirstScale": 0.48,
      "playbackIndicatorStaticSecondScale": 0.82,
      "playbackIndicatorStaticThirdScale": 0.62,
      "playbackIndicatorFirstDurationMs": 1200,
      "playbackIndicatorSecondDurationMs": 1380,
      "playbackIndicatorThirdDurationMs": 1280,
      "playbackIndicatorStaggerMs": 100,
      "playbackIndicatorSecondKeyTimeRatio": 0.24,
      "playbackIndicatorThirdKeyTimeRatio": 0.5,
      "playbackIndicatorFourthKeyTimeRatio": 0.76,
      "playbackIndicatorFirstPatternFirstScale": 0.32,
      "playbackIndicatorFirstPatternSecondScale": 0.94,
      "playbackIndicatorFirstPatternThirdScale": 0.54,
      "playbackIndicatorFirstPatternFourthScale": 0.76,
      "playbackIndicatorFirstPatternFifthScale": 0.32,
      "playbackIndicatorSecondPatternFirstScale": 0.72,
      "playbackIndicatorSecondPatternSecondScale": 0.38,
      "playbackIndicatorSecondPatternThirdScale": 1,
      "playbackIndicatorSecondPatternFourthScale": 0.58,
      "playbackIndicatorSecondPatternFifthScale": 0.72,
      "playbackIndicatorThirdPatternFirstScale": 0.46,
      "playbackIndicatorThirdPatternSecondScale": 0.82,
      "playbackIndicatorThirdPatternThirdScale": 0.34,
      "playbackIndicatorThirdPatternFourthScale": 0.96,
      "playbackIndicatorThirdPatternFifthScale": 0.46,
      "playbackIndicatorScrimOpacity": 0.34
    },
    "mediaTable": {
      "compactRowHeight": 50,
      "standardRowHeight": 58,
      "comfortableRowHeight": 68,
      "compactHeaderHeight": 34,
      "standardHeaderHeight": 38,
      "comfortableHeaderHeight": 42,
      "compactArtworkSize": 34,
      "standardArtworkSize": 40,
      "comfortableArtworkSize": 48,
      "horizontalInset": 24,
      "selectionHorizontalInset": 8,
      "selectionVerticalInset": 3,
      "columnSpacing": 12,
      "actionWidth": 28,
      "favoriteControlWidth": 30,
      "songContentSpacing": 8,
      "minimumSongWidth": 360,
      "collectionWidth": 190,
      "yearWidth": 64,
      "durationWidth": 64,
      "lineHeight": 19,
      "lineGap": 2,
      "explicitBadgeGap": 7,
      "explicitBadgeWidth": 16,
      "explicitBadgeHeight": 16
    },
    "player": {
      "minimumHeight": 96,
      "contentHeight": 56,
      "artworkSide": 56,
      "artworkHoverOpacity": 0.36,
      "controlSize": 34,
      "progressHeight": 4,
      "progressMinimumWidth": 220,
      "progressIdealWidth": 300,
      "progressMaximumWidth": 360,
      "progressLabelWidth": 34,
      "metadataMinimumWidth": 244,
      "metadataMaximumWidth": 380,
      "outputWidth": 244,
      "transportMinimumWidth": 500,
      "volumeButtonSize": 28,
      "volumeWidth": 86,
      "panelPickerWidth": 184
    },
    "queue": {
      "rowHeight": 52,
      "artworkSide": 42,
      "rowGap": 12,
      "rowTextGap": 3,
      "trailingControlWidth": 28,
      "durationWidth": 40,
      "rowHorizontalPadding": 8,
      "rowVerticalPadding": 4,
      "insertionHeight": 2,
      "insertionHorizontalInset": 8,
      "insertionOpacity": 0.9,
      "insertionYOffset": -1,
      "dragPreviewWidth": 330,
      "dragPreviewPadding": 10,
      "dragPreviewGap": 10,
      "dragPreviewArtworkSide": 38,
      "dragPreviewTextGap": 2,
      "dragPreviewBorderOpacity": 0.14,
      "dragPreviewShadowOpacity": 0.38,
      "dragPreviewShadowRadius": 16,
      "dragPreviewShadowYOffset": 8
    },
    "lyrics": {
      "lineGap": 18,
      "stanzaBreakHeight": 10,
      "inactiveOpacity": 0.58,
      "inactiveBlurRadius": 0.45,
      "followDurationMs": 320,
      "viewportHorizontalPadding": 34,
      "viewportVerticalPadding": 34,
      "lineSpacing": 3,
      "edgeFadeHeight": 32
    },
    "metadata": {
      "badgeHeight": 28,
      "badgeHorizontalPadding": 10,
      "badgeGap": 8,
      "detailsWidth": 360,
      "detailsPadding": 20,
      "detailsSectionGap": 16,
      "detailsTitleGap": 3,
      "detailsColumnGap": 20,
      "detailsRowGap": 9
    },
    "about": {
      "iconSide": 96,
      "readableWidth": 480
    }
  },
  "field": {
    "height": "{size.controlStandard}",
    "radius": "{radius.control}",
    "paddingX": "{space.3}",
    "states": [
      "pristine",
      "editing",
      "valid",
      "invalid",
      "disabled",
      "readOnly"
    ]
  },
  "table": {
    "rowHeights": {
      "compact": "{size.rowCompact}",
      "standard": "{size.rowStandard}"
    },
    "headerHeight": "{size.controlStandard}",
    "columnGap": "{space.4}",
    "selectionRequiresTextOrShape": true,
    "sortRequiresDirection": true,
    "media": {
      "rowHeight": 48,
      "artworkSide": 32,
      "playbackIndicatorSide": 14
    }
  },
  "navigation": {
    "railCompact": "{size.railCompact}",
    "sidebarCompact": "{size.sidebarCompact}",
    "sidebarStandard": "{size.sidebarStandard}",
    "itemHeight": "{size.rowCompact}",
    "minimumIconTarget": "{size.targetPointer}",
    "states": [
      "default",
      "hover",
      "focused",
      "selected",
      "disabled"
    ]
  },
  "overlay": {
    "popoverMaxWidth": 360,
    "dialogReadableWidth": 480,
    "sheetReadableWidth": 640,
    "scrim": "fill.scrim",
    "focusTrapRequired": true,
    "restoreFocusRequired": true
  },
  "keycap": {
    "height": 24,
    "paddingX": 7,
    "radius": "{radius.control}",
    "gap": 4
  },
  "status": {
    "iconSize": "{size.iconS}",
    "gap": 6,
    "colorAloneForbidden": true,
    "requiredParts": [
      "symbol-or-shape",
      "plain-language-label"
    ]
  },
  "extensions": {
    "rawMetricExceptions": {
      "panel.artwork.surfaceCornerRadius": "Preserves the reusable artwork presentation geometry and appearance contract.",
      "panel.artwork.highlightOpacity": "Preserves the reusable artwork presentation geometry and appearance contract.",
      "panel.artwork.highlightSizeRatio": "Preserves the reusable artwork presentation geometry and appearance contract.",
      "panel.artwork.highlightBlurRatio": "Preserves the reusable artwork presentation geometry and appearance contract.",
      "panel.artwork.highlightOffsetXRatio": "Preserves the reusable artwork presentation geometry and appearance contract.",
      "panel.artwork.highlightOffsetYRatio": "Preserves the reusable artwork presentation geometry and appearance contract.",
      "panel.artwork.scrimOpacity": "Preserves the reusable artwork presentation geometry and appearance contract.",
      "panel.artwork.symbolOpacity": "Preserves the reusable artwork presentation geometry and appearance contract.",